{"$schema":"https://json-schema.org/draft/2020-12/schema","$id":"brpl-v4-policy.schema.json","type":"object","required":["schema","kind","id","rules"],"properties":{"schema":{"const":"brpl-policy/v4"},"kind":{"enum":["repository","task"]},"id":{"type":"string","pattern":"^[A-Za-z][A-Za-z0-9_.-]{0,127}$"},"repository":{"type":"object","required":["name","root"],"properties":{"name":{"type":"string","minLength":1},"root":{"type":"string","minLength":1}},"additionalProperties":false},"areas":{"type":"array","items":{"type":"object","required":["id","paths"],"properties":{"id":{"type":"string"},"paths":{"type":"array","minItems":1,"items":{"type":"string"}}},"additionalProperties":false}},"components":{"type":"array","items":{"type":"object","required":["id","paths"],"properties":{"id":{"type":"string"},"paths":{"type":"array","minItems":1,"items":{"type":"string"}}},"additionalProperties":false}},"rules":{"type":"array","items":{"type":"object","required":["id","kind"],"properties":{"id":{"type":"string","pattern":"^[A-Z][A-Z0-9-]{2,63}$"},"kind":{"enum":["changes","protect","generated","forbid-edge","forbid-path","component-adjacency","acyclic","dependencies","require","threshold"]},"severity":{"enum":["error","warning"]},"mode":{"enum":["only","deny"]},"selectors":{"type":"array","items":{"type":"string"}},"relation":{"type":"string"},"from":{"type":"string"},"to":{"type":"string"},"allowed":{"type":"array"},"manifest":{"type":"string"},"allow_add":{"type":"array","items":{"type":"string"}},"allow_remove":{"type":"array","items":{"type":"string"}},"check":{"type":"string"},"summary":{"type":"string"},"metric":{"type":"string"},"operator":{"enum":["at-most","at-least"]},"value":{"type":["integer","string"]},"unit":{"type":"string"}},"additionalProperties":false}}},"additionalProperties":false}
