{"schema":"brpl-policy/v4","kind":"repository","id":"example-service","repository":{"name":"Example service","root":"."},"areas":[{"id":"application","paths":["src/application/**"]},{"id":"infrastructure","paths":["src/infrastructure/**"]}],"components":[{"id":"application","paths":["src/application/**"]},{"id":"infrastructure","paths":["src/infrastructure/**"]}],"rules":[{"id":"ARCH-001","kind":"forbid-path","relation":"source-import","from":"@infrastructure","to":"@application"},{"id":"ARCH-002","kind":"component-adjacency","relation":"source-import","allowed":[{"from":"application","to":"infrastructure"}]}]}
